{
    "registry-version": 1,

    "author": "Paulo Silva",
    "name": "windowmakerbased_4lba",
    "title": "WindowMaker-based",
    "description": "This one was a bit based on WindowMaker window decoration - the buttons are a bit different, all arranged in the left side, and they all have hover and press behaviours.",
    "homepage": "https://notabug.org/nitrofurano/pekwmthemes",
    "source": {
        "type": "git",
        "git": {
            "remote": "https://notabug.org/nitrofurano/pekwmthemes.git",
            "branch": "master"
        },
        "base-path": "themes/windowmakerbased_4lba"
    }
}
