{
    "registry-version": 1,

    "author": "Claes Nästén",
    "name": "default-plain",
    "title": "pekwm default plain theme (no images)",
    "source": {
        "type": "git",
        "git": {
            "remote": "https://github.com/pekdon/pekwm.git",
            "branch": "master"
        },
        "base-path": "data/themes/default-plain"
    }
}
