{
    "registry-version": 1,

    "author": "Claes Nästén",
    "name": "winter",
    "title": "pekwm 0.3.0 default theme",
    "source": {
        "type": "git",
        "git": {
            "remote": "https://github.com/pekwm/pekwm.git",
            "branch": "master"
        },
        "base-path": "data/themes/winter"
    }
}
