{
    "registry-version": 1,

    "author": "Claes Nästén",
    "name": "ion-p",
    "title": "ION styled themes for pekwm",
    "homepage": "https://github.com/pekdon/pekwm-theme-ion-p",
    "source": {
        "type": "git",
        "git": {
            "remote": "https://github.com/pekdon/pekwm-theme-ion-p.git",
            "branch": "main"
        }
    }
}
