{
    "registry-version": 1,

    "author": "Paulo Silva",
    "name": "NeoMotif",
    "title": "NeoMotif",
    "description": "An embrionary stage of a Motif-like theme for PekWM",
    "homepage": "https://notabug.org/nitrofurano/pekwmthemes",
    "source": {
        "type": "git",
        "git": {
            "remote": "https://notabug.org/nitrofurano/pekwmthemes.git",
            "branch": "master"
        },
        "base-path": "themes/NeoMotif"
    }
}
