{
    "registry-version": 1,

    "author": "Paulo Silva",
    "name": "minimal4dwm",
    "title": "minimal4dwm",
    "description": "",
    "homepage": "https://notabug.org/nitrofurano/pekwmthemes",
    "source": {
        "type": "git",
        "git": {
            "remote": "https://notabug.org/nitrofurano/pekwmthemes.git",
            "branch": "master"
        },
        "base-path": "themes/minimal4dwm"
    }
}
